{
  "schemaVersion": 1,
  "generatedAt": "2026-07-29T17:44:50.018Z",
  "verificationLevel": "fixture",
  "target": {
    "serverProfile": "generic",
    "serverVersion": "fixture-v1",
    "artifact": "openclaw-channel-jmap:generic-rfc8620-rfc8621-fixture-v1"
  },
  "probe": {
    "packageVersion": "0.4.1",
    "sourceRevision": "e0f4bb2bc25bc8c4f3cb50f6d0df4c33e477a5f1",
    "reportSha256": "f727dcbfe71d1ac47f23b2c1741171edc73f7e6ee852810f96ca64d263afe733"
  },
  "report": {
    "schemaVersion": 1,
    "generatedAt": "2026-07-29T17:44:49.834Z",
    "serverProfile": "generic",
    "serverLabel": "Other standards-based JMAP server",
    "scope": "full",
    "accountId": "default",
    "authMode": "bearer",
    "verdict": "compatible",
    "advertisedCapabilities": [
      "urn:ietf:params:jmap:core",
      "urn:ietf:params:jmap:mail",
      "urn:ietf:params:jmap:submission"
    ],
    "checks": [
      {
        "id": "configuration",
        "status": "pass",
        "required": true,
        "evidence": "advertised",
        "code": "configured"
      },
      {
        "id": "session-discovery",
        "status": "pass",
        "required": true,
        "evidence": "invoked",
        "code": "session-and-mailbox-ready",
        "durationMs": 32
      },
      {
        "id": "mailbox-get",
        "status": "pass",
        "required": true,
        "evidence": "invoked",
        "code": "method-succeeded"
      },
      {
        "id": "core-capability",
        "status": "pass",
        "required": true,
        "evidence": "advertised",
        "code": "capability-advertised"
      },
      {
        "id": "mail-capability",
        "status": "pass",
        "required": true,
        "evidence": "advertised",
        "code": "capability-advertised"
      },
      {
        "id": "mailbox-rights",
        "status": "pass",
        "required": true,
        "evidence": "advertised",
        "code": "management-rights-advertised"
      },
      {
        "id": "email-query",
        "status": "pass",
        "required": true,
        "evidence": "invoked",
        "code": "method-succeeded",
        "durationMs": 4
      },
      {
        "id": "email-query-changes",
        "status": "pass",
        "required": false,
        "evidence": "invoked",
        "code": "method-succeeded",
        "durationMs": 3
      },
      {
        "id": "receive-polling",
        "status": "pass",
        "required": true,
        "evidence": "invoked",
        "code": "poll-strategy-verified"
      },
      {
        "id": "email-metadata",
        "status": "pass",
        "required": true,
        "evidence": "invoked",
        "code": "email-get-succeeded",
        "durationMs": 11
      },
      {
        "id": "thread-get",
        "status": "pass",
        "required": false,
        "evidence": "invoked",
        "code": "method-succeeded"
      },
      {
        "id": "submission-capability",
        "status": "pass",
        "required": true,
        "evidence": "advertised",
        "code": "capability-advertised"
      },
      {
        "id": "identity-get",
        "status": "pass",
        "required": true,
        "evidence": "invoked",
        "code": "identity-available"
      },
      {
        "id": "download-url",
        "status": "pass",
        "required": true,
        "evidence": "advertised",
        "code": "template-advertised"
      },
      {
        "id": "upload-url",
        "status": "pass",
        "required": true,
        "evidence": "advertised",
        "code": "template-advertised"
      },
      {
        "id": "event-source-url",
        "status": "pass",
        "required": true,
        "evidence": "advertised",
        "code": "template-advertised"
      }
    ],
    "features": {
      "receivePolling": "verified",
      "search": "verified",
      "read": "verified",
      "thread": "verified",
      "update": "advertised",
      "send": "advertised",
      "push": "advertised",
      "attachmentDownload": "advertised",
      "attachmentUpload": "advertised"
    },
    "rfc8621": {
      "pluginRelease": "0.4.1",
      "totalMethods": 26,
      "methods": [
        {
          "method": "Mailbox/get",
          "pluginStatus": "implemented",
          "serverStatus": "verified"
        },
        {
          "method": "Mailbox/changes",
          "pluginStatus": "implemented",
          "serverStatus": "advertised"
        },
        {
          "method": "Mailbox/query",
          "pluginStatus": "planned",
          "serverStatus": "advertised"
        },
        {
          "method": "Mailbox/queryChanges",
          "pluginStatus": "planned",
          "serverStatus": "advertised"
        },
        {
          "method": "Mailbox/set",
          "pluginStatus": "planned",
          "serverStatus": "advertised"
        },
        {
          "method": "Thread/get",
          "pluginStatus": "implemented",
          "serverStatus": "verified"
        },
        {
          "method": "Thread/changes",
          "pluginStatus": "implemented",
          "serverStatus": "advertised"
        },
        {
          "method": "Email/get",
          "pluginStatus": "implemented",
          "serverStatus": "verified"
        },
        {
          "method": "Email/changes",
          "pluginStatus": "implemented",
          "serverStatus": "advertised"
        },
        {
          "method": "Email/query",
          "pluginStatus": "implemented",
          "serverStatus": "verified"
        },
        {
          "method": "Email/queryChanges",
          "pluginStatus": "partial",
          "serverStatus": "verified"
        },
        {
          "method": "Email/set",
          "pluginStatus": "partial",
          "serverStatus": "advertised"
        },
        {
          "method": "Email/copy",
          "pluginStatus": "implemented",
          "serverStatus": "advertised"
        },
        {
          "method": "Email/import",
          "pluginStatus": "implemented",
          "serverStatus": "advertised"
        },
        {
          "method": "Email/parse",
          "pluginStatus": "implemented",
          "serverStatus": "advertised"
        },
        {
          "method": "SearchSnippet/get",
          "pluginStatus": "implemented",
          "serverStatus": "advertised"
        },
        {
          "method": "Identity/get",
          "pluginStatus": "implemented",
          "serverStatus": "verified"
        },
        {
          "method": "Identity/changes",
          "pluginStatus": "implemented",
          "serverStatus": "advertised"
        },
        {
          "method": "Identity/set",
          "pluginStatus": "planned",
          "serverStatus": "advertised"
        },
        {
          "method": "EmailSubmission/get",
          "pluginStatus": "implemented",
          "serverStatus": "advertised"
        },
        {
          "method": "EmailSubmission/changes",
          "pluginStatus": "implemented",
          "serverStatus": "advertised"
        },
        {
          "method": "EmailSubmission/query",
          "pluginStatus": "implemented",
          "serverStatus": "advertised"
        },
        {
          "method": "EmailSubmission/queryChanges",
          "pluginStatus": "planned",
          "serverStatus": "advertised"
        },
        {
          "method": "EmailSubmission/set",
          "pluginStatus": "partial",
          "serverStatus": "advertised"
        },
        {
          "method": "VacationResponse/get",
          "pluginStatus": "planned",
          "serverStatus": "advertised"
        },
        {
          "method": "VacationResponse/set",
          "pluginStatus": "planned",
          "serverStatus": "advertised"
        }
      ]
    },
    "probePolicy": {
      "sideEffectsPerformed": false,
      "messageBodiesRead": false,
      "messageIdentifiersExposed": false,
      "outboundDeliveryVerified": false
    },
    "limitations": [
      "The safe probe never sends mail or mutates mailbox state.",
      "A passing send check verifies advertised Submission support and an Identity, not delivery."
    ]
  }
}
