{
  "schemaVersion": 1,
  "generatedAt": "2026-07-29T11:41:49.657Z",
  "verificationLevel": "lab",
  "target": {
    "serverProfile": "apache-james",
    "serverVersion": "3.9.0",
    "artifact": "apache/james:memory-3.9.0@sha256:c7d6172292a902ca7be5f16dace658f42d31bfca62a0a38598bee7a6dab09434"
  },
  "probe": {
    "packageVersion": "0.3.0",
    "sourceRevision": "490a743aaba7b8921ecbd0dd2415a7a19954adae",
    "reportSha256": "28140e9f390dbd653f65313ebdc94d942e74cd96daefdd1ee293a6cc97b5c7a6"
  },
  "report": {
    "schemaVersion": 1,
    "generatedAt": "2026-07-29T11:37:04.494Z",
    "serverProfile": "apache-james",
    "serverLabel": "Apache James",
    "scope": "full",
    "accountId": "default",
    "authMode": "basic",
    "verdict": "compatible",
    "advertisedCapabilities": [
      "urn:apache:james:params:jmap:delegation",
      "urn:apache:james:params:jmap:mail:identity:sortorder",
      "urn:apache:james:params:jmap:mail:quota",
      "urn:apache:james:params:jmap:mail:shares",
      "urn:ietf:params:jmap:core",
      "urn:ietf:params:jmap:mail",
      "urn:ietf:params:jmap:mdn",
      "urn:ietf:params:jmap:quota",
      "urn:ietf:params:jmap:submission",
      "urn:ietf:params:jmap:vacationresponse",
      "urn:ietf:params:jmap:websocket"
    ],
    "checks": [
      {
        "id": "configuration",
        "status": "pass",
        "required": true,
        "evidence": "advertised",
        "code": "configured"
      },
      {
        "id": "session-discovery",
        "status": "pass",
        "required": true,
        "evidence": "invoked",
        "code": "session-and-mailbox-ready",
        "durationMs": 687
      },
      {
        "id": "mailbox-get",
        "status": "pass",
        "required": true,
        "evidence": "invoked",
        "code": "method-succeeded"
      },
      {
        "id": "core-capability",
        "status": "pass",
        "required": true,
        "evidence": "advertised",
        "code": "capability-advertised"
      },
      {
        "id": "mail-capability",
        "status": "pass",
        "required": true,
        "evidence": "advertised",
        "code": "capability-advertised"
      },
      {
        "id": "mailbox-rights",
        "status": "pass",
        "required": true,
        "evidence": "advertised",
        "code": "management-rights-advertised"
      },
      {
        "id": "email-query",
        "status": "pass",
        "required": true,
        "evidence": "invoked",
        "code": "method-succeeded",
        "durationMs": 203
      },
      {
        "id": "email-query-changes",
        "status": "fail",
        "required": false,
        "evidence": "invoked",
        "code": "jmap-unknownmethod",
        "durationMs": 11
      },
      {
        "id": "poll-snapshot-fallback",
        "status": "pass",
        "required": false,
        "evidence": "invoked",
        "code": "recent-query-dedupe-fallback",
        "durationMs": 16
      },
      {
        "id": "receive-polling",
        "status": "pass",
        "required": true,
        "evidence": "invoked",
        "code": "poll-strategy-verified"
      },
      {
        "id": "email-metadata",
        "status": "pass",
        "required": true,
        "evidence": "invoked",
        "code": "email-get-succeeded",
        "durationMs": 488
      },
      {
        "id": "thread-get",
        "status": "pass",
        "required": false,
        "evidence": "invoked",
        "code": "method-succeeded"
      },
      {
        "id": "submission-capability",
        "status": "pass",
        "required": true,
        "evidence": "advertised",
        "code": "capability-advertised"
      },
      {
        "id": "identity-get",
        "status": "pass",
        "required": true,
        "evidence": "invoked",
        "code": "identity-available"
      },
      {
        "id": "download-url",
        "status": "pass",
        "required": true,
        "evidence": "advertised",
        "code": "template-advertised"
      },
      {
        "id": "upload-url",
        "status": "pass",
        "required": true,
        "evidence": "advertised",
        "code": "template-advertised"
      },
      {
        "id": "event-source-url",
        "status": "pass",
        "required": true,
        "evidence": "advertised",
        "code": "template-advertised"
      }
    ],
    "features": {
      "receivePolling": "verified",
      "search": "verified",
      "read": "verified",
      "thread": "verified",
      "update": "advertised",
      "send": "advertised",
      "push": "advertised",
      "attachmentDownload": "advertised",
      "attachmentUpload": "advertised"
    },
    "probePolicy": {
      "sideEffectsPerformed": false,
      "messageBodiesRead": false,
      "messageIdentifiersExposed": false,
      "outboundDeliveryVerified": false
    },
    "limitations": [
      "The safe probe never sends mail or mutates mailbox state.",
      "A passing send check verifies advertised Submission support and an Identity, not delivery."
    ]
  }
}
