{
  "schemaVersion": 1,
  "generatedAt": "2026-07-29T19:14:37.355Z",
  "verificationLevel": "live",
  "target": {
    "serverProfile": "stalwart",
    "serverVersion": "0.16.12",
    "artifact": "stalwartlabs/stalwart:v0.16@sha256:c73f7b39f5873c4641a9808cb3425a80e1fafe06271f477575a7ca7ead7d37b5"
  },
  "probe": {
    "packageVersion": "0.4.1",
    "sourceRevision": "5fe6d3165dab8f68e5fed693e86a94a62906bca7",
    "reportSha256": "829fbec74fb445dc01dc8348c5aa7e5fd63ce6ca3e5bb56d41646bef8350465c"
  },
  "report": {
    "schemaVersion": 1,
    "generatedAt": "2026-07-29T19:13:46.022Z",
    "serverProfile": "stalwart",
    "contract": "self-addressed-submission-v1",
    "verdict": "compatible",
    "checks": [
      {
        "id": "session",
        "status": "pass"
      },
      {
        "id": "identity-safety",
        "status": "pass"
      },
      {
        "id": "self-draft-create",
        "status": "pass"
      },
      {
        "id": "exact-preview",
        "status": "pass"
      },
      {
        "id": "explicit-submit",
        "status": "pass"
      },
      {
        "id": "submission-get",
        "status": "pass"
      },
      {
        "id": "submission-query",
        "status": "pass"
      },
      {
        "id": "delayed-send-policy",
        "status": "pass"
      },
      {
        "id": "cancellation-boundary",
        "status": "pass"
      }
    ],
    "observations": {
      "acceptanceObserved": true,
      "submissionStatusObserved": true,
      "deliveryStatusObserved": true,
      "submissionGet": "observed",
      "submissionQuery": "observed",
      "immediateUndoStatus": "final",
      "scheduling": "canceled"
    },
    "probePolicy": {
      "sideEffectsPerformed": true,
      "selfAddressedOnly": true,
      "externalRecipientsUsed": false,
      "submissionAttempted": true,
      "finalDeliveryClaimed": false,
      "cleanupConfirmed": true
    }
  }
}
